{
  "specversion": "1.0",
  "id": "c7900b35287e4066ed22b7358126f5456e93e6178c55f32456e9f6bc9eb27503",
  "source": "caldav://calendar.example.com/dav/calendars/64f1c0a2e9b1d3f4a5b6c7d8/64f1c0a2e9b1d3f4a5b6c7d8/",
  "type": "fr.linagora.twalk.calendar.event.removed.v1",
  "time": "2026-10-09T07:12:40Z",
  "subject": "mailto:michel@example.com",
  "datacontenttype": "application/json",
  "dataschema": "https://schemas.twalk.dev/cloudevents/v1/calendar.event.removed.schema.json",
  "connection": "agenda-linagora",
  "data": {
    "uid": "8f3a2b1c-4d5e-6f70-8192-a3b4c5d6e7f8",
    "title": "Weekly sync"
  }
}
